{
  "id": "ols-003",
  "family": "ols",
  "title": "OLS with HC3 errors on a near collinear design",
  "case_type": "edge",
  "narrative": "x2 is x1 plus a perturbation with standard deviation 0.02, which makes X prime X nearly singular and the individual coefficients badly identified even though their sum is not. HC3 divides the squared residual by one minus the leverage squared, and leverage is exactly where an ill conditioned design bites hardest, so this case tests the leverage computation and the numerical stability of the solver at the same time.",
  "fixture": {
    "generator": "ols_near_collinear",
    "path": "fixtures/ols-003.csv",
    "sha256": "3626aa2d8d12830e734b53f2167ba09a930e21b4159d1c8133b560d1aba0dc4b"
  },
  "model": {
    "kind": "ols",
    "response": "y",
    "regressors": [
      "x1",
      "x2"
    ],
    "intercept": true,
    "vcov": "HC3"
  },
  "comparison": {
    "tolerance": {
      "rtol": 1e-06,
      "atol": 1e-12,
      "rationale": "This design is deliberately ill conditioned, so the relative error of the solved coefficients scales with the condition number. A 1e-6 budget reflects that amplification and is still three orders of magnitude tighter than any economically meaningful difference.",
      "key_overrides": [
        {
          "pattern": "params.*.pvalue",
          "rtol": 0.0001,
          "atol": 1e-300,
          "rationale": "The tail integral amplifies the already amplified coefficient error on an ill conditioned design, so the p-value budget is widened in proportion. It stops at 1e-4 because a budget of 1e-3 would exactly equal the mutation size and let a real one part in a thousand change tie with the tolerance, and any divergence beyond this is recorded in docs/divergences.md with the measured number rather than absorbed silently."
        }
      ]
    },
    "exclude": []
  }
}
