{
  "id": "fe-003",
  "family": "panel_fe",
  "title": "One way fixed effects on an unbalanced panel",
  "case_type": "edge",
  "narrative": "Entity lengths vary between three and twelve periods, so the entity means used by the within transformation have different denominators. Implementations that demean with a common divisor, or that silently drop short entities, will disagree here. The number of entities and the total number of observations are both asserted so a silent drop cannot pass as agreement.",
  "fixture": {
    "generator": "panel_unbalanced",
    "path": "fixtures/fe-003.csv",
    "sha256": "7828b652b95a4caf7908052fc981a9996b7f0f9dffa79bbfdfd823bf5fa21403"
  },
  "model": {
    "kind": "panel_fe",
    "response": "y",
    "regressors": [
      "x1",
      "x2"
    ],
    "entity": "entity"
  },
  "comparison": {
    "tolerance": {
      "rtol": 1e-09,
      "atol": 1e-12,
      "rationale": "Both sides read identical CSV bytes and solve the same normal equations in IEEE 754 double precision, so the only admissible difference is accumulated rounding from a different factorisation order. That is bounded well below 1e-9 relative on a well conditioned design; anything larger is a definitional disagreement, not noise.",
      "key_overrides": [
        {
          "pattern": "params.*.pvalue",
          "rtol": 1e-05,
          "atol": 1e-300,
          "rationale": "P-values span thirty orders of magnitude, so a fixed absolute floor would make small ones untestable. A purely relative budget of 1e-5 absorbs the amplification of coefficient rounding through the tail integral while still failing a one part in a thousand perturbation. The 1e-300 floor only handles underflow to zero."
        }
      ]
    },
    "exclude": []
  }
}
