{
  "id": "adf-001",
  "family": "adf",
  "title": "Augmented Dickey Fuller regression on a stationary series",
  "case_type": "nominal",
  "narrative": "A stationary first order autoregression with coefficient 0.55 and an intercept in the test regression. The augmented Dickey Fuller statistic is the t ratio on the lagged level, and the whole point of specifying the regression explicitly, rather than calling a library routine, is that implementations disagree about how many observations to keep and where the trend term starts. Here the sample runs from observation lags plus two to the end, which leaves T minus lags minus one usable rows on both sides.",
  "fixture": {
    "generator": "series_stationary",
    "path": "fixtures/adf-001.csv",
    "sha256": "8fe75d4adbe7147a9736de3f7273944e2fdc7b7a7aa22a5c67651aafbbb5e8ab"
  },
  "model": {
    "kind": "adf",
    "series": "y",
    "lags": 2,
    "trend": "c"
  },
  "comparison": {
    "tolerance": {
      "rtol": 1e-09,
      "atol": 1e-12,
      "rationale": "Both sides read identical CSV bytes and solve the same normal equations in IEEE 754 double precision, so the only admissible difference is accumulated rounding from a different factorisation order. That is bounded well below 1e-9 relative on a well conditioned design; anything larger is a definitional disagreement, not noise.",
      "key_overrides": [
        {
          "pattern": "params.*.pvalue",
          "rtol": 1e-05,
          "atol": 1e-300,
          "rationale": "P-values span thirty orders of magnitude, so a fixed absolute floor would make small ones untestable. A purely relative budget of 1e-5 absorbs the amplification of coefficient rounding through the tail integral while still failing a one part in a thousand perturbation. The 1e-300 floor only handles underflow to zero."
        }
      ]
    },
    "exclude": []
  }
}
