{
  "id": "fe-001",
  "family": "panel_fe",
  "title": "One way fixed effects on a balanced panel",
  "case_type": "nominal",
  "narrative": "Sixty entities observed for eight periods each, with entity effects drawn independently of the regressors. The within estimator is algebraically identical to least squares with sixty dummy variables, and the only thing that can differ between implementations is the residual degrees of freedom, which must be n minus the number of entities minus the number of regressors. Getting that wrong inflates every t statistic.",
  "fixture": {
    "generator": "panel_balanced",
    "path": "fixtures/fe-001.csv",
    "sha256": "26fdac06aa5ce41cb8298794ffb6cf930952ee00a3157690b87e905fb01fda42"
  },
  "model": {
    "kind": "panel_fe",
    "response": "y",
    "regressors": [
      "x1",
      "x2"
    ],
    "entity": "entity"
  },
  "comparison": {
    "tolerance": {
      "rtol": 1e-09,
      "atol": 1e-12,
      "rationale": "Both sides read identical CSV bytes and solve the same normal equations in IEEE 754 double precision, so the only admissible difference is accumulated rounding from a different factorisation order. That is bounded well below 1e-9 relative on a well conditioned design; anything larger is a definitional disagreement, not noise.",
      "key_overrides": [
        {
          "pattern": "params.*.pvalue",
          "rtol": 1e-05,
          "atol": 1e-300,
          "rationale": "P-values span thirty orders of magnitude, so a fixed absolute floor would make small ones untestable. A purely relative budget of 1e-5 absorbs the amplification of coefficient rounding through the tail integral while still failing a one part in a thousand perturbation. The 1e-300 floor only handles underflow to zero."
        }
      ]
    },
    "exclude": []
  }
}
