{
  "id": "adf-003",
  "family": "adf",
  "title": "Augmented Dickey Fuller regression with a deterministic trend",
  "case_type": "edge",
  "narrative": "A deterministic trend plus stationary autoregressive noise, tested with both a constant and a trend in the regression. The trend regressor is defined as the original one based position of each observation, not as one through the length of the trimmed sample, because those two conventions give different intercepts and different trend coefficients while leaving the statistic on the lagged level unchanged. Fixing the convention in the spec is what makes the intercept comparable at all.",
  "fixture": {
    "generator": "series_trend_stationary",
    "path": "fixtures/adf-003.csv",
    "sha256": "93fe7ba484a2bdd886d91f1e06fb9cb0348315ece517cc7f2d2c500a8046d2bf"
  },
  "model": {
    "kind": "adf",
    "series": "y",
    "lags": 3,
    "trend": "ct"
  },
  "comparison": {
    "tolerance": {
      "rtol": 1e-09,
      "atol": 1e-12,
      "rationale": "Both sides read identical CSV bytes and solve the same normal equations in IEEE 754 double precision, so the only admissible difference is accumulated rounding from a different factorisation order. That is bounded well below 1e-9 relative on a well conditioned design; anything larger is a definitional disagreement, not noise.",
      "key_overrides": [
        {
          "pattern": "params.*.pvalue",
          "rtol": 1e-05,
          "atol": 1e-300,
          "rationale": "P-values span thirty orders of magnitude, so a fixed absolute floor would make small ones untestable. A purely relative budget of 1e-5 absorbs the amplification of coefficient rounding through the tail integral while still failing a one part in a thousand perturbation. The 1e-300 floor only handles underflow to zero."
        }
      ]
    },
    "exclude": []
  }
}
